temaNumero,situacaoTema,ramoDireito,questaoSubmetidaJulgamento,teseFirmada,numeroProcesso,dataDecisaoAfetacao,relator,dataJulgamento,dataPublicacaoAcordao,transitoJulgado,pdfPath
1,Julgado,DIREITO PREVIDENCIÁRIO,"Saber qual a forma de cálculo da aposentadoria por invalidez, do auxílio-doença e pensões derivadas, em momento antecedente à edição da Lei n. 9.876/99.","O valor da aposentadoria por invalidez e do auxílio-doença, bem como das pensões destes derivados ou calculadas com base no art. 75, da Lei n. 8.213/91, será obtido, na forma do art. 29, II, do mesmo diploma, por meio da média aritmética simples dos 80% maiores salários de contribuição, considerado todo o período contributivo, independentemente do momento de inscrição do segurado e do número de contribuições mensais do período contributivo.",PEDILEF 2009.51.51.066212-3/ RJ,10/06/2011,Juiz Federal Vladimir Santos Vitovsky,02/08/2011,16/09/2011,05/10/2011,outputs\runs\run-20260613T193921027193Z\data\themes\tema-1.pdf
2,Julgado,DIREITO PREVIDENCIÁRIO,Saber se certidão de casamento extemporânea serve como início de prova material para fins de concessão de aposentadoria por idade rural.,"No caso de aposentadoria por idade rural, a certidão de casamento vale como início de prova material, ainda que extemporânea.",PEDILEF 2006.82.01.505208-4/ PB,04/03/2010,Juiz Federal Paulo Ricardo Arena Filho,06/09/2011,30/09/2011,18/10/2011,outputs\runs\run-20260613T193921027193Z\data\themes\tema-2.pdf
3,Julgado,DIREITO PREVIDENCIÁRIO,"Saber se a prova material extemporânea, devidamente corroborada por prova oral idônea, é hábil à concessão do benefício de aposentadoria por idade rural.","No caso de aposentadoria por idade rural, é dispensável a existência de prova documental contemporânea, podendo ser estendida a outros períodos através de robusta prova testemunhal.",PEDILEF 2005.81.10.001065-3/ CE,06/11/2009,Juíza Federal Simone dos Santos Lemos Fernandes,06/09/2011,04/10/2011,20/10/2011,outputs\runs\run-20260613T193921027193Z\data\themes\tema-3.pdf
4,Julgado,DIREITO PREVIDENCIÁRIO,"Saber se é necessário prévio pedido de prorrogação de benefício de auxílio-doença nas hipóteses conhecidas por ""alta programada"".","É devido o restabelecimento do auxílio-doença nas hipóteses conhecidas por “alta programada”, independentemente de prévio pedido administrativo de prorrogação. VIDE TEMA 164/TNU",PEDILEF 2007.70.50.016551-5/ PR,08/03/2010,Juíza Federal Simone dos Santos Lemos Fernandes,06/09/2011,04/10/2011,17/08/2012,outputs\runs\run-20260613T193921027193Z\data\themes\tema-4.pdf
5,Revisado pelo Tema 145,DIREITO PREVIDENCIÁRIO,Saber se para obtenção da aposentadoria por idade de segurado especial é necessário demonstrar atividade rural no período imediatamente anterior ao atingimento da idade mínima ou à apresentação do requerimento administrativo.,"Para a obtenção de aposentadoria por idade rural, é indispensável o exercício e a demonstração da atividade campesina correspondente à carência no período imediatamente anterior ao atingimento da idade mínima ou ao requerimento administrativo (TESE FIRMADA NO TEMA 145).",PEDILEF 2006.71.95.01 8143-8/ RS,05/08/2010,Juiz Federal Gláucio Ferreira Maciel Gonçalves,12/12/2013,17/01/2014 04/10/2011,07/02/2014,outputs\runs\run-20260613T193921027193Z\data\themes\tema-5.pdf
